{
  "schemaVersion": "moonshot-kimi-independent-review-config.v3",
  "configId": "mkirc_moonshot_kimi_k3_002",
  "lifecycle": "CANDIDATE",
  "reviewerProvider": "moonshot",
  "reviewerModel": "kimi-k3",
  "baseURL": "https://api.moonshot.ai/v1",
  "endpoint": "/chat/completions",
  "tokenEstimateEndpoint": "/tokenizers/estimate-token-count",
  "credentialEnv": "MOONSHOT_API_KEY",
  "keychainServiceRecommendation": "kimi-p2-independent-review",
  "keychainAccountRecommendation": "p2-independent-review",
  "contextWindowTokens": 1048576,
  "reasoningEffort": "max",
  "thinkingOmitted": true,
  "toolChoice": "none",
  "toolsOmitted": true,
  "responseFormat": {
    "type": "json_schema",
    "strict": true,
    "name": "independent_model_review_output_v2"
  },
  "forbiddenRequestFields": [
    "frequency_penalty",
    "n",
    "presence_penalty",
    "temperature",
    "thinking",
    "tools",
    "top_p"
  ],
  "maxCompletionTokens": 32768,
  "safetyMarginTokens": 8192,
  "nonMessageVisibleTokenReserve": 65536,
  "nonMessageVisibleInputMaxUtf8Bytes": 16384,
  "nonMessageVisibleInputCanonicalization": "JSON_UTF8_FIXED_REQUEST_WITHOUT_MESSAGES_V1",
  "tokenEstimateCoverage": "EXACT_MESSAGES_PLUS_FIXED_NON_MESSAGE_RESERVE",
  "maxReviewMaterialUtf8Bytes": 4194304,
  "maxRequestUtf8Bytes": 8388608,
  "maxResponseUtf8Bytes": 1048576,
  "contextBudgetBasis": "TRANSPORT_RESOURCE_CEILING_ONLY_NOT_CONTEXT_PROOF",
  "pricing": {
    "currency": "USD",
    "taxBasis": "TAX_EXCLUSIVE",
    "unitTokens": 1000000,
    "cacheHitInputMicrosPerMillion": 300000,
    "cacheMissInputMicrosPerMillion": 3000000,
    "outputMicrosPerMillion": 15000000,
    "asOf": "2026-08-01"
  },
  "taxExclusiveBudgetMicros": 4000000,
  "officialContract": {
    "modelUrl": "https://platform.kimi.ai/docs/models",
    "chatUrl": "https://platform.kimi.ai/docs/api/chat",
    "tokenEstimateUrl": "https://platform.kimi.ai/docs/api/estimate",
    "structuredOutputUrl": "https://platform.kimi.ai/docs/guide/response_format",
    "pricingUrl": "https://platform.kimi.ai/",
    "researchPath": "docs/research/moonshot-kimi-k3-transport-contract-v3-2026-08-01.md",
    "researchSha256": "sha256:fad98df32d8e9e5755a3e8030be1c883deeae7fabf277425ad01389f0259f76d",
    "queriedAt": "2026-08-01"
  },
  "fallbackPolicy": "DISABLED_FAIL_CLOSED",
  "configSha256": "sha256:32436b4ec44cb68414bebc92cb93f7e455572bef5e798e01b3bc0c83f1fee5b4"
}
